id,publish_date,headline_category,headline_text
1,20010101,sports.wwe,win over cena satisfying but defeating undertaker bigger roman reigns
2,20010102,bollywood,Raju Chacha
3,20010102,unknown,Status quo will not be disturbed at Ayodhya; says Vajpayee
4,20010102,unknown,Fissures in Hurriyat over Pak visit
5,20010102,unknown,America's unwanted heading for India?
6,20010102,unknown,For bigwigs; it is destination Goa
7,20010102,unknown,Extra buses to clear tourist traffic
8,20010102,unknown,Dilute the power of transfers; says Riberio
9,20010102,unknown,Focus shifts to teaching of Hindi
10,20010102,unknown,IT will become compulsory in schools
11,20010102,unknown,Move to stop freedom fighters' pension flayed
12,20010102,unknown,Gilani claims he applied for passport 2 years ago
13,20010102,unknown,Parivar dismisses PM's warning
14,20010102,unknown,India; Pak exchange lists of N-plants
15,20010102,unknown,Will Qureshi's return really help the govt?
16,20010102,unknown,PM's tacit message: Put Ram tample on hold
17,20010102,unknown,Text of the Prime Minister's article
18,20010102,unknown,NCW to focus on violence against women
19,20010102,unknown,BBC's reality TV will focus on AIIMS
20,20010102,unknown,Jaitley firm on legal reforms
21,20010102,unknown,Hoshangabad farmers have enough water
22,20010102,unknown,BJP jumps into rail track conversion issue
23,20010102,unknown,America's unwanted heading for India?
24,20010102,unknown,State may take AP to court over Krishna
25,20010102,unknown,This official has sued the briber
26,20010102,unknown,Park turns temple compound as residents watch
27,20010102,unknown,Moves afoot to evict squatters in Urban dist
28,20010102,unknown,Mafia calls the shots in Gandhinagar too
29,20010102,unknown,Status quo will not be disturbed at Ayodhya; says Vajpayee
30,20010102,unknown,Fissures in Hurriyat over Pak visit
31,20010102,unknown,America's unwanted heading for India?
32,20010102,unknown,For bigwigs; it is destination Goa
33,20010102,unknown,Extra buses to clear tourist traffic
34,20010102,unknown,Dilute the power of transfers; says Riberio
35,20010102,unknown,Focus shifts to teaching of Hindi
36,20010102,unknown,IT will become compulsory in schools
37,20010102,unknown,Move to stop freedom fighters' pension flayed
38,20010102,unknown,Gilani claims he applied for passport 2 years ago
39,20010102,unknown,Parivar dismisses PM's warning
40,20010102,unknown,India; Pak exchange lists of N-plants
41,20010102,unknown,Will Qureshi's return really help the govt?
42,20010102,unknown,PM's tacit message: Put Ram tample on hold
43,20010102,unknown,Text of the Prime Minister's article
44,20010102,unknown,NCW to focus on violence against women
45,20010102,unknown,BBC's reality TV will focus on AIIMS
46,20010102,unknown,Jaitley firm on legal reforms
47,20010102,unknown,Hoshangabad farmers have enough water
48,20010102,unknown,BJP jumps into rail track conversion issue
49,20010102,unknown,America's unwanted heading for India?
50,20010102,unknown,State may take AP to court over Krishna
51,20010102,unknown,This official has sued the briber
52,20010102,unknown,Park turns temple compound as residents watch
53,20010102,unknown,Moves afoot to evict squatters in Urban dist
54,20010102,unknown,Mafia calls the shots in Gandhinagar too
55,20010102,unknown,Come to Nandi Hills .. and you can fly
56,20010102,unknown,HAL approached for super jumbo project
57,20010102,unknown,Nagathihalli returns with Preethiya Hudugi
58,20010102,unknown,Fashion in the future
59,20010102,unknown,Promises to keep
60,20010102,unknown,Home is where the holistic science is
61,20010102,unknown,A noisy effort to spruce up Commercial Street
62,20010102,unknown,The best music of the year
63,20010102,unknown,Redemption night; amid some rock
64,20010102,unknown,Consul is back from month-long leave
65,20010102,unknown,Bomb hoax triggers panic in Canara Bank
66,20010102,unknown,Petition over ministers' assets dismissed
67,20010102,unknown,He beat polio; but a truck driver's is no life
68,20010102,unknown,Destroying myths and doubts on sexuality
69,20010102,unknown,Planning Dept seeks Rs 350 crore more
70,20010102,unknown,More engg colleges if needed in state: Govt
71,20010102,unknown,Auto driver's murder: 4 held
72,20010102,unknown,Meet held on cashew crop forecasting
73,20010102,unknown,Awareness rally on AIDS today
74,20010102,unknown,Record power generation at RTPS
75,20010102,unknown,Move to stop freedom fighters' pension flayed
76,20010102,unknown,Snags delay digital maps of city
77,20010102,unknown,Making education a people's movement
78,20010102,unknown,Murder spoils 2001 party in Dharwad
79,20010102,unknown,Now a website on a seer
80,20010102,unknown,Akki-Alur and Ranebennur peaceful
81,20010102,unknown,Weekly editor resorts to hunger strike
82,20010102,unknown,Bickering cost Dal(S) seats; admits Gowda
83,20010102,unknown,BJP to block traffic statewide on Jan 6
84,20010102,unknown,Dr Patwardhan to be felicitated
85,20010102,unknown,Lingambudhi will be turned into bird sanctuary
86,20010102,unknown,Cactus which made it to Guinness is dying
87,20010102,unknown,VIPs suffer as power supply is stopped to govt guest houses
88,20010103,entertainment.hindi.bollywood.news,'Devdas': Jinxed?
89,20010103,unknown,Powerless north India gropes in the dark
90,20010103,unknown,Think again; Laxman tells Sangh Parivar
91,20010103,unknown,Hurriyat undecided over team to Pakistan
92,20010103,unknown,Vajpayee wants to put reforms on fast track
93,20010103,unknown,Stephen Hawking keeps date with Mumbai
94,20010103,unknown,Anti-Hrithik or anti-hopelessness
95,20010103,unknown,Govt plans stadium near Panaji
96,20010103,unknown,BJP doing a volte face on casinos: Cong
97,20010103,unknown,3 watershed projects on the anvil
98,20010103,unknown,No report yet on fire in Udyog Bhavan
99,20010103,unknown,He is the king of 'five star' industry
100,20010103,unknown,Petrol pump sealed for selling adulterated fuel
101,20010103,unknown,Milk price up by Rs 1 per litre
102,20010103,unknown,Congress House is no-smoking zone
103,20010103,unknown,Rural weightage: Govt reassures Governor
104,20010103,unknown,Bride gets honeymoon surprise: Chopper ride
105,20010103,unknown,Is hangover a sign of alcoholicism?
106,20010103,unknown,Almatti: AP to wait and watch
107,20010103,unknown,10-year-old girl missing
108,20010103,unknown,Hear his messages from the heart
109,20010103,unknown,Dance like no one's watching
110,20010103,unknown,From reel love to real love
111,20010103,unknown,Power row: Bribe attempt charge denied
112,20010103,unknown,Lakshamma's cry for help heard
113,20010103,unknown,It's shopping time for your newborn
114,20010103,unknown,Con games on the catwalk
115,20010103,unknown,They are here to help us
116,20010103,unknown,These noisy spots are hurting your ears
117,20010103,unknown,Flat tyres; flat music and a few famous faces
118,20010103,unknown,Yogananda birth anniversary fete on Dec 5
119,20010103,unknown,Tumkur gets 243 borewells
120,20010103,unknown,Over 2000 workers hit by lockout
121,20010103,unknown,Child project officer held for fraud
122,20010103,unknown,BCC holds talks on budget
123,20010103,unknown,'Skybus metro trains on agenda'
124,20010103,unknown,A disciple awaits a miracle from his Goddess
125,20010103,unknown,TOI scribe among Press Academy awardees
126,20010103,unknown,Talent Search exams on April 29
127,20010103,unknown,Ban orders extended in Ranebennur
128,20010103,unknown,Army turns to HAL for Lancer supply
129,20010104,business.india-business,Car dealers caught in Bihar sales tax ruling
130,20010104,city.bengaluru,He's not so inscrutable
131,20010104,city.bengaluru,Three in race for chief secy's post
132,20010104,city.delhi,DPCC stages Nyay rally
133,20010104,city.patna,Druggists' stir leads to shortage of medicines
134,20010104,hollywood,Space Cowboys
135,20010104,india,'Dudhwa tiger died of starvation; not poisoning'
136,20010104,unknown,The string that pulled Stephen Hawking to India
137,20010104,unknown,Vajpayee gives big push to tech education; R&D
138,20010104,unknown,Norms for private role in banking tightened
139,20010104,unknown,A Maha Kumbh of media players
140,20010104,unknown,Net lottery: A winner or a sucker?
141,20010104,unknown,Us and the PM's Musings
142,20010104,unknown,Milosevic to be charged with 'abuse of office'
143,20010104,unknown,Tabu: Bar Bar Dekho
144,20010104,unknown,Anupam Kher: Sliver Spoon!
145,20010104,unknown,Aftab Shivdasani: Career Cares!
146,20010104,unknown,Court reserves judgment on custody of Ilyasi's daughter
147,20010104,unknown,A museum far from the madding crowds
148,20010104,unknown,Bangla Oppn leader issues 'fatwa' against judges
149,20010104,unknown,Hawking set to inspire science glitterati
150,20010104,unknown,Mission for technology education; more funds for R&D
151,20010104,unknown,Mental illness can pass from parent to child
152,20010104,unknown,Cholera outbreak source traced
153,20010104,unknown,'Mathematics permeates human civilisation'
154,20010104,unknown,Bangla Oppn leader issues 'fatwa' against judges
155,20010104,unknown,Bangladesh govt asks for Hamoodur Rahman report
156,20010104,unknown,Bangladesh 'scrutinising' citizen's death in US embassy
157,20010104,unknown,Claire Danes inks to star in 'It's About Love'
158,20010104,unknown,Hollywood posts record 9th year of box office gains
159,20010104,unknown,Akashdeep: Ghaath Ka Saath!
160,20010104,unknown,Great loss to Indian racing
161,20010104,unknown,The saga of Usha Stud Farm
162,20010104,unknown,Red Radior wins Victory Zone Cup
163,20010104,unknown,Race put off
164,20010104,unknown,Cyril sends Byron Black packing
165,20010104,unknown,Dent has the fastest serve in Chennai meet
166,20010104,unknown,Basu gives call to stop infighting
167,20010104,unknown,Violence mar Mamata's meeting in Midnapore
168,20010104,unknown,The string that pulled Stephen Hawking to India
169,20010104,unknown,Norms for private role in banking tightened
170,20010104,unknown,Net lottery: A winner or a sucker?
171,20010104,unknown,Us and the PM's Musings
172,20010104,unknown,Milosevic to be charged with 'abuse of office'
173,20010104,unknown,Tabu: Bar Bar Dekho
174,20010104,unknown,Anupam Kher: Sliver Spoon!
175,20010104,unknown,Court reserves judgment on custody of Ilyasi's daughter
176,20010104,unknown,A museum far from the madding crowds
177,20010104,unknown,Bangla Oppn leader issues 'fatwa' against judges
178,20010104,unknown,Court reserves judgment on custody of Ilyasi's daughter
179,20010104,unknown,String theory set to become one of hottest pieces of physics
180,20010104,unknown,Hawking set to inspire science glitterati
181,20010104,unknown,Mission for technology education; more funds for R&D
182,20010104,unknown,Mission for technology education; more funds for R&D
183,20010104,unknown,Mental illness can pass from parent to child
184,20010104,unknown,Cholera outbreak source traced
185,20010104,unknown,'Mathematics permeates human civilisation'
186,20010104,unknown,The string that pulled Stephen Hawking to India
187,20010104,unknown,Vajpayee gives big push to tech education; R&D
188,20010104,unknown,Norms for private role in banking tightened
189,20010104,unknown,A Maha Kumbh of media players
190,20010104,unknown,Net lottery: A winner or a sucker?
191,20010104,unknown,Us and the PM's Musings
192,20010104,unknown,Milosevic to be charged with 'abuse of office'
193,20010104,unknown,Tabu: Bar Bar Dekho
194,20010104,unknown,Anupam Kher: Sliver Spoon!
195,20010104,unknown,Aftab Shivdasani: Career Cares!
196,20010104,unknown,Court reserves judgment on custody of Ilyasi's daughter
197,20010104,unknown,A museum far from the madding crowds
198,20010104,unknown,Four more Iranians admit to role in serial murders
199,20010104,unknown,Bangla Oppn leader issues 'fatwa' against judges
200,20010104,unknown,String theory set to become one of hottest pieces of physics
201,20010104,unknown,Hawking set to inspire science glitterati
202,20010104,unknown,Mission for technology education; more funds for R&D
203,20010104,unknown,Mental illness can pass from parent to child
204,20010104,unknown,Cholera outbreak source traced
205,20010104,unknown,'Mathematics permeates human civilisation'
206,20010104,unknown,Bangla Oppn leader issues 'fatwa' against judges
207,20010104,unknown,Bangladesh govt asks for Hamoodur Rahman report
208,20010104,unknown,Bangladesh 'scrutinising' citizen's death in US embassy
209,20010104,unknown,Hollywood posts record 9th year of box office gains
210,20010104,unknown,Great loss to Indian racing
211,20010104,unknown,The saga of Usha Stud Farm
212,20010104,unknown,Red Radior wins Victory Zone Cup
213,20010104,unknown,Race put off
214,20010104,unknown,Basu gives call to stop infighting
215,20010104,unknown,Violence mar Mamata's meeting in Midnapore
216,20010104,unknown,CPT to have new pilot system by Jan 15
217,20010104,unknown,Film industry concerned about piracy
218,20010104,unknown,City drainage system being modernised
219,20010104,unknown,Keeping the Gandhian dream alive
220,20010104,unknown,An archaeologist par excellence
221,20010104,unknown,Education body overshoots self-imposed deadline
222,20010104,unknown,PIL urges to seek flood relief from UN
223,20010104,unknown,Sen urges country to exploit its tourism potential
224,20010104,unknown,CMC to issue notice to builder
225,20010104,unknown,World govt touted as solution to crises
226,20010104,unknown,ASI team digs up part of Fatehpur Sikri
227,20010104,unknown,Lara joins elite club
228,20010104,unknown,Cullinan hits fourth Newlands hundred
229,20010104,unknown,'Cronje case behind low cricket match attendance'
230,20010104,unknown,Indian refusal cost PCB 2.4 cr
231,20010104,unknown,Das ready to face the short-pitch stuff
232,20010104,unknown,Haldipur; Lahiri in good stand
233,20010104,unknown,DU North Zone inter-varsity cricket champions
234,20010104,unknown,Kolkata gears up for Millennium Cup
235,20010104,unknown,Right choice is the key; says Iranian coach
236,20010104,unknown,Rajasthan lose lead and match
237,20010104,unknown,Hockey hopes rest on flowerin talent
238,20010104,unknown,Anand may get Padmabhushan
239,20010104,unknown,Emotion-choked Chennai showers love on Anand
240,20010104,unknown,Close battle for Mahindra Golfer; 2001
241,20010104,unknown,Indian Blues off to a good start
242,20010104,unknown,Ramgarh beat Royal Kashmir in Hanut Cup polo
243,20010104,unknown,Anand may get Padmabhushan
244,20010104,unknown,Cullinan hits fourth Newlands hundred
245,20010104,unknown,Ex-mayor takes up cudgels against Kothrud garbage depot
246,20010104,unknown,India is no IT superpower
247,20010104,unknown,A clean sweep
248,20010104,unknown,The Sphinx can act too
249,20010104,unknown,Giving audio-video education a cutting edge
250,20010104,unknown,Govt orders study of river diversion
251,20010104,unknown,Govt bears burden as VIPs throng Goa
252,20010104,unknown,Goa told to start quick-growth coconut project
253,20010104,unknown,Experts discuss horticulture development
254,20010104,unknown,5 acquitted in trespassing case
255,20010104,unknown,Development of horticulture stressed
256,20010104,unknown,New office-bearers for ICSI
257,20010104,unknown,CM to review security for Premji; Murthy
258,20010104,unknown,Govt allots UKP project to KPC
259,20010104,unknown,Star hotels in city get tech-savvy
260,20010104,unknown,When principals wed
261,20010104,unknown,Misbehaving conductors face action
262,20010104,unknown,Pubs are on the watch for violence
263,20010104,unknown,Celestial show awaits aircraft lovers
264,20010104,unknown,Kannada organisations oppose felicitating Nedumaran
265,20010104,unknown,Civic polls: Minister refutes BJP charges
266,20010104,unknown,Oh; for that black & white magic!
267,20010104,unknown,No clue about kidnapped boy
268,20010104,unknown,New year hash: They paid Rs 18;000; went hungry
269,20010104,unknown,5;000 anganwadis to get buildings
270,20010104,unknown,Cops shoot at sandalwood smugglers; nab one
271,20010104,unknown,Tribute-paying ritual for Patel today
272,20010104,unknown,A life snuffed out needlessly
273,20010104,unknown,PM arriving on a 2-day visit
274,20010104,unknown,'Make mysterious kidnap drama secret public'
275,20010104,unknown,Pollution makes these residents see red
276,20010104,unknown,Behind the walls; it's celebration time
277,20010104,unknown,'Corporate cricket has lot of scope'
278,20010104,unknown,An art gallery for the underprivileged
279,20010104,unknown,Annual Infant Jesus feast from Jan 14
280,20010104,unknown,Ex-Karnataka HC judge visits Bahrain
281,20010105,india,MP best in forest development: Centre
282,20010105,unknown,Light combat craft takes India into club class
283,20010105,unknown,Hawkings' day out
284,20010105,unknown,Light combat craft takes India into club class
285,20010105,unknown,Easy drugs at raves keep Goa hot on tourist circuit
286,20010105,unknown,CM defends grant to Chaturang
287,20010105,unknown,Faleiro vows to fight common cadre proposal
288,20010105,unknown,Sawant questions casino licences
289,20010105,unknown,MPT posts good show in 2000
290,20010105,unknown,Ex-GPCC chief against separate cadre
291,20010105,unknown,Meeting to review anti-defection law
292,20010105,unknown,Telecom team win play contest
293,20010105,unknown,Guala Closures bags ISO 9002 certificate
294,20010105,unknown,Bush names Lindsey top economic aide
295,20010105,unknown,Bush names Lindsey top economic aide
296,20010105,unknown,Indian American boy confesses to parents' murder
297,20010105,unknown,Anti-immigration think-tank berates Clinton regime
298,20010105,unknown,Sikh teacher guilty of assaulting student
299,20010105,unknown,Australia; New Zealand urged to accept Indo-Fijian refugees
300,20010105,unknown,If Rabuka can go free; why not us: Speight partner
301,20010105,unknown,Tailor Sam's famous clientele
302,20010105,unknown,Malaysian medics testify about demonstrators' injuries
303,20010105,unknown,Philippine soldiers arrest bombing suspects
304,20010105,unknown,Chinese stranded in Dhaka repatriated
305,20010105,unknown,It's long haul yet for the LCA
306,20010105,unknown,Captain Courageous says dream has come true
307,20010105,unknown,LCA to be good enough for next 45 yrs
308,20010105,unknown,LCA to be top in avionics; strike capability
309,20010105,unknown,Light combat craft takes India into club class
310,20010105,unknown,Hawkings' day out
311,20010105,unknown,Easy drugs at raves keep Goa hot on tourist circuit
312,20010105,unknown,CM defends grant to Chaturang
313,20010105,unknown,Faleiro vows to fight common cadre proposal
314,20010105,unknown,Sawant questions casino licences
315,20010105,unknown,MPT posts good show in 2000
316,20010105,unknown,Ex-GPCC chief against separate cadre
317,20010105,unknown,Meeting to review anti-defection law
318,20010105,unknown,Telecom team win play contest
319,20010105,unknown,Guala Closures bags ISO 9002 certificate
320,20010105,unknown,Bush names Lindsey top economic aide
321,20010105,unknown,Bush names Lindsey top economic aide
322,20010105,unknown,Indian American boy confesses to parents' murder
323,20010105,unknown,Indian American boy confesses to parents' murder
324,20010105,unknown,Anti-immigration think-tank berates Clinton regime
325,20010105,unknown,Sikh teacher guilty of assaulting student
326,20010105,unknown,Australia; New Zealand urged to accept Indo-Fijian refugees
327,20010105,unknown,If Rabuka can go free; why not us: Speight partner
328,20010105,unknown,Tailor Sam's famous clientele
329,20010105,unknown,Malaysian medics testify about demonstrators' injuries
330,20010105,unknown,Philippine soldiers arrest bombing suspects
331,20010105,unknown,Chinese stranded in Dhaka repatriated
332,20010105,unknown,Light combat craft takes India into club class
333,20010105,unknown,It's long haul yet for the LCA
334,20010105,unknown,Captain Courageous says dream has come true
335,20010105,unknown,LCA to be good enough for next 45 yrs
336,20010105,unknown,LCA to be top in avionics; strike capability
337,20010105,unknown,CM asks KPTC to keep power tariff hike in abeyance
338,20010105,unknown,Gowda and Hegde share dais; but fail to talk
339,20010105,unknown,This cactus is all set to break records
340,20010105,unknown,Function can't be stopped: Kharge
341,20010105,unknown,Think twice before you make a wish
342,20010105,unknown,LCA: Best weapon system for close combat
343,20010105,unknown,LCA test flight puts India in exclusive club
344,20010105,unknown,A dream-come-true for LCA pilot
345,20010105,unknown,Avionics provides multi-role capability to LCA
346,20010105,unknown,Hoax bomb call sends family into a tizzy
347,20010105,unknown,Govt order on dismantling Hampi bridge stayed
348,20010105,unknown,Principals of PU colleges to meet on Jan. 7
349,20010105,unknown,CM meets Sonia at airport
350,20010105,unknown,Tributes paid to Patel
351,20010105,unknown,I am a great fan of Sridevi: Prema
352,20010105,unknown,This chef knows his yin from yang
353,20010105,unknown,Wait; wait .. for the bus that never comes
354,20010105,unknown,Taal se taal mila
355,20010105,unknown,Light combat craft takes India into club class
356,20010105,unknown,Hawkings' day out
357,20010105,unknown,Easy drugs at raves keep Goa hot on tourist circuit
358,20010105,unknown,CM defends grant to Chaturang
359,20010105,unknown,Sawant questions casino licences
360,20010105,unknown,MPT posts good show in 2000
361,20010105,unknown,Ex-GPCC chief against separate cadre
362,20010105,unknown,Meeting to review anti-defection law
363,20010105,unknown,Guala Closures bags ISO 9002 certificate
364,20010105,unknown,Bush names Lindsey top economic aide
365,20010105,unknown,Bush names Lindsey top economic aide
366,20010105,unknown,Indian American boy confesses to parents' murder
367,20010105,unknown,Anti-immigration think-tank berates Clinton regime
368,20010105,unknown,Sikh teacher guilty of assaulting student
369,20010105,unknown,Australia; New Zealand urged to accept Indo-Fijian refugees
370,20010105,unknown,If Rabuka can go free; why not us: Speight partner
371,20010105,unknown,Tailor Sam's famous clientele
372,20010105,unknown,Malaysian medics testify about demonstrators' injuries
373,20010105,unknown,Philippine soldiers arrest bombing suspects
374,20010105,unknown,Chinese stranded in Dhaka repatriated
375,20010105,unknown,Light combat craft takes India into club class
376,20010105,unknown,It's long haul yet for the LCA
377,20010105,unknown,Captain Courageous says dream has come true
378,20010105,unknown,LCA to be good enough for next 45 yrs
379,20010105,unknown,LCA to be top in avionics; strike capability
380,20010105,unknown,CM asks KPTC to keep power tariff hike in abeyance
381,20010105,unknown,Gowda and Hegde share dais; but fail to talk
382,20010105,unknown,This cactus is all set to break records
383,20010105,unknown,Function can't be stopped: Kharge
384,20010105,unknown,Think twice before you make a wish
385,20010105,unknown,LCA: Best weapon system for close combat
386,20010105,unknown,LCA will be aircraft for next 45 years
387,20010105,unknown,LCA test flight puts India in exclusive club
388,20010105,unknown,A dream-come-true for LCA pilot
389,20010105,unknown,Avionics provides multi-role capability to LCA
390,20010105,unknown,Hoax bomb call sends family into a tizzy
391,20010105,unknown,Govt order on dismantling Hampi bridge stayed
392,20010105,unknown,Principals of PU colleges to meet on Jan. 7
393,20010105,unknown,CM meets Sonia at airport
394,20010105,unknown,Tributes paid to Patel
395,20010105,unknown,I am a great fan of Sridevi: Prema
396,20010105,unknown,This chef knows his yin from yang
397,20010105,unknown,Wait; wait .. for the bus that never comes
398,20010105,unknown,Taal se taal mila
399,20010105,unknown,Mahalakshmi Layout: Crumbling past; rapid growth
400,20010105,unknown,'We're waiting for people with money'
401,20010105,unknown,An actress and many other things besides
402,20010105,unknown,Mobile isn't a phone but a fun machine now
403,20010105,unknown,Time to bow out for 14 top bureaucrats
404,20010105,unknown,Silk is sexy this year
405,20010105,unknown,Seeds firm condemns hooliganism
406,20010106,unknown,Light combat craft takes India into club class
407,20010106,unknown,Hawkings' day out
408,20010106,unknown,Ex-GPCC chief against separate cadre
409,20010106,unknown,Meeting to review anti-defection law
410,20010106,unknown,Telecom team win play contest
411,20010106,unknown,Guala Closures bags ISO 9002 certificate
412,20010106,unknown,Bush names Lindsey top economic aide
413,20010106,unknown,Bush names Lindsey top economic aide
414,20010106,unknown,Indian American boy confesses to parents' murder
415,20010106,unknown,Anti-immigration think-tank berates Clinton regime
416,20010106,unknown,Sikh teacher guilty of assaulting student
417,20010106,unknown,Australia; New Zealand urged to accept Indo-Fijian refugees
418,20010107,unknown,Muslim body rules out talks on Ayodhya
419,20010107,unknown,Bajrang Dal blows hot; cold
420,20010107,unknown,Vajpayee rejects Nitish's resignation
421,20010107,unknown,PM taps diaspora to realise Indian ambition
422,20010107,unknown,India cagey about food imports
423,20010107,unknown,US leggy chicks to come in hordes
424,20010107,unknown,Microsoft; Intel line up top-end products for electronics show
425,20010107,unknown,Khosla among Upside's 25 people to watch in 2001
426,20010107,unknown,Spending on Net projects may be hit
427,20010107,unknown,British doctor may be worst mass murderer in modern history
