id,publish_date,headline_category,headline_text
428,20010107,unknown,British judge reveals threats from racists
429,20010107,unknown,Clinton urges US Congress to ratify CTBT
430,20010107,unknown,Blind climber to scale Mt. Everest
431,20010107,unknown,Does American TV have a realism overdose?
432,20010107,unknown,Banking community must chalk out new system: Jalan
433,20010107,unknown,Delhi to host India-EU working group meeting on IT
434,20010107,unknown,PNB raises rates
435,20010107,unknown,Are green activists the new imperialists
436,20010107,unknown,Muslim body rules out talks on Ayodhya
437,20010107,unknown,Bajrang Dal blows hot; cold
438,20010107,unknown,Vajpayee rejects Nitish's resignation
439,20010107,unknown,PM taps diaspora to realise Indian ambition
440,20010107,unknown,India cagey about food imports
441,20010107,unknown,US leggy chicks to come in hordes
442,20010107,unknown,Microsoft; Intel line up top-end products for electronics show
443,20010107,unknown,Khosla among Upside's 25 people to watch in 2001
444,20010107,unknown,Spending on Net projects may be hit
445,20010107,unknown,British doctor may be worst mass murderer in modern history
446,20010107,unknown,British judge reveals threats from racists
447,20010107,unknown,Clinton urges US Congress to ratify CTBT
448,20010107,unknown,Blind climber to scale Mt. Everest
449,20010107,unknown,Does American TV have a realism overdose?
450,20010107,unknown,Banking community must chalk out new system: Jalan
451,20010107,unknown,Delhi to host India-EU working group meeting on IT
452,20010107,unknown,Are green activists the new imperialists
453,20010107,unknown,Asian auto firms bullish on US market
454,20010107,unknown,Clinton urges US Congress to ratify CTBT
455,20010107,unknown,US gets its first multicultural cabinet
456,20010107,unknown,Indian American couple sentenced for injuries to child
457,20010107,unknown,Mumbai firm to be sentenced in US
458,20010107,unknown,'Parsi men have failed their women'
459,20010107,unknown,Does American TV have a realism overdose?
460,20010107,unknown,Transit; port use to top talks during Nepal minister's visit
461,20010107,unknown,Kuldip Sharma's exit will lead to sea change in policing
462,20010107,unknown,WREB warns SEBs of north-like tripping
463,20010107,unknown,Chaotic traffic in Mehsana: Authorities have washed hands
464,20010107,unknown,MSU gears up for NAAC visit; expects a five-star rating
465,20010107,unknown,Residents here have invested in bore-wells
466,20010107,unknown,Need for farmers to become professionals: Expert
467,20010107,unknown,Aamir Khan: 'Lagaan' ko zabaan do
468,20010107,unknown,Rajkumar Santoshi: Khan pe khan
469,20010107,unknown,Kamal Haasan: Hey (Thenali) Ram
470,20010107,unknown,Darshans show Bollywood a way out of financial woes
471,20010107,unknown,Latest Hrithik movie could make Canberra a hit
472,20010107,unknown,The Bali beat goes beyond bhangra
473,20010107,unknown,Tops to trousers; they're going for gold!
474,20010107,unknown,Aamir Khan: 'Lagaan' ko zabaan do
475,20010107,unknown,Rajkumar Santoshi: Khan pe khan
476,20010107,unknown,Kamal Haasan: Hey (Thenali) Ram
477,20010107,unknown,Darshans show Bollywood a way out of financial woes
478,20010107,unknown,German TV admits millionaire show was a sham
479,20010107,unknown,Parliament suggests resignation of TV official
480,20010107,unknown,Traffic lights
481,20010107,unknown,Just one of those faces
482,20010107,unknown,Steve Waugh looks forward to Indian summer
483,20010107,unknown,Strong comeback by Shane Warne
484,20010107,unknown,Cricket board chief means business
485,20010108,unknown,Sangh Parivar; Babri panel up the ante
486,20010108,unknown,Frontrunner for key US post seen having Pak tilt
487,20010108,unknown,Muslims see red over Coke logo
488,20010108,unknown,Move over Nepal; Casino Goa is here
489,20010108,unknown,Merit Calling
490,20010108,unknown,Closures putting financial strain on Delhi Govt
491,20010108,unknown,42 units to be sealed in phase-II of operation closure
492,20010108,unknown,Special trains for Kumbh Mela
493,20010108,unknown,CPM for survey of units
494,20010108,unknown,NIEPA meet to discuss issue of re-employing retired teachers
495,20010108,unknown,Such a long journey to the green dispenser
496,20010108,unknown,Woman fighting for life as 'quack' performed MTP
497,20010108,unknown,Cold weather puts strain on people with weak hearts
498,20010108,unknown,Secrecy has no place in democracy; says Sorabjee
499,20010108,unknown,On the hitlist are the polluting units
500,20010108,unknown,Driver makes of with cash in employer's Zen
501,20010108,unknown,Rs 25;000 compensation for 10-yr-old domestic help
502,20010108,unknown,What can one do about the backache 'epidemic'
503,20010108,unknown,Criminals beat up family with iron rods
504,20010108,unknown,Three held for stealing power
505,20010108,unknown,Road accident toll in Noida was 130 last year
506,20010108,unknown,Blood donation camp organised
507,20010108,unknown,The policemen find a new excuse: Television in slums
508,20010108,unknown,Paramour; accomplice get life term for killing woman
509,20010108,unknown,Policing the metro: Year-end musings
510,20010108,unknown,Sangh Parivar; Babri panel up the ante
511,20010108,unknown,Frontrunner for key US post seen having Pak tilt
512,20010108,unknown,Muslims see red over Coke logo
513,20010108,unknown,Move over Nepal; Casino Goa is here
514,20010108,unknown,Merit Calling
515,20010108,unknown,Closures putting financial strain on Delhi Govt
516,20010108,unknown,42 units to be sealed in phase-II of operation closure
517,20010108,unknown,Special trains for Kumbh Mela
518,20010108,unknown,CPM for survey of units
519,20010108,unknown,NIEPA meet to discuss issue of re-employing retired teachers
520,20010108,unknown,Such a long journey to the green dispenser
521,20010108,unknown,Woman fighting for life as 'quack' performed MTP
522,20010108,unknown,Cold weather puts strain on people with weak hearts
523,20010108,unknown,Secrecy has no place in democracy; says Sorabjee
524,20010108,unknown,On the hitlist are the polluting units
525,20010108,unknown,Driver makes of with cash in employer's Zen
526,20010108,unknown,Rs 25;000 compensation for 10-yr-old domestic help
527,20010108,unknown,What can one do about the backache 'epidemic'
528,20010108,unknown,Criminals beat up family with iron rods
529,20010108,unknown,Three held for stealing power
530,20010108,unknown,Road accident toll in Noida was 130 last year
531,20010108,unknown,Blood donation camp organised
532,20010108,unknown,The policemen find a new excuse: Television in slums
533,20010108,unknown,Paramour; accomplice get life term for killing woman
534,20010108,unknown,Policing the metro: Year-end musings
535,20010108,unknown,Sullied Symbol
536,20010108,unknown,Sullied Symbol
537,20010108,unknown,Temple Tactics
538,20010108,unknown,Conflict Diamonds
539,20010108,unknown,Vajpayee's Musings
540,20010108,unknown,Sabarimala; Abode Of Lord Ayyappa
541,20010108,unknown,Pleasure Principle
542,20010108,unknown,Concept of Creation
543,20010108,unknown,I'm just a supporter of LTTE: Nedumaran
544,20010108,unknown,HAL will showcase its pride at Aero-2001
545,20010108,unknown,I will prove charges against Mishra: J K Jain
546,20010108,unknown,Samata faces split over JD merger
547,20010108,unknown,Cellphone is proving a curse for the mafia
548,20010108,unknown,The Kamasutra girl is real cool
549,20010108,unknown,Ayurveda is more than oil massage
550,20010108,unknown,Balle Balle Boys hit the charts
551,20010109,unknown,Officials brace for millennium's first Mahakumbh
552,20010109,unknown,Financier Bharat Shah held for alleged links with Chotta Shakeel
553,20010109,unknown,Officials brace for millennium's first Mahakumbh
554,20010109,unknown,Material souls to seek salvation by the Ganga
555,20010109,unknown,Vajpayee woos Vietnam with infotech
556,20010109,unknown,All party meet on joint cadre issue soon: CM
557,20010109,unknown,One more advocate general for Goa soon
558,20010109,unknown,Order on plastic ban soon
559,20010109,unknown,Campaign to educate vendors selling cigarette; gutka
560,20010109,unknown,Hike in water tariff from March
561,20010109,unknown,Construction of Swatantra Veer Chowk mooted
562,20010109,unknown,Lunar eclipse on Jan. 9 and 10
563,20010109,unknown,Hefty phone bill shocks officials
564,20010109,unknown,50 handicaps to get artificial limbs
565,20010109,unknown,ABVP organises reception for students
566,20010109,unknown,Infrastructure development corporation to be constituted
567,20010109,unknown,Seminar on industrial gases from Jan. 19
568,20010109,unknown,New molecule to fight malaria found
569,20010109,unknown,Brain's sensory filter smaller in schizophrenics
570,20010109,unknown,Mice to blame for childhood asthma?
571,20010109,unknown,Controlled drinking may be answer for alcoholics
572,20010109,unknown,'No radiation sickness among Bulgarian troops'
573,20010109,unknown,STF is working without sleep; food: Sangliana
574,20010109,unknown,Danger lurks at most city pubs
575,20010109,unknown,Centre's ditherings dangerous: Chandra Shekhar
576,20010109,unknown,New tariffs bad news for cellphone operators
577,20010109,unknown,Jaya Jaitly unanimously elected Samata chief
578,20010109,unknown,Bus station at Shivajinagar set to open
579,20010109,unknown,CM gets a 'majority darshan'
580,20010109,unknown,CET Cell returns Rs 13 cr to govt
581,20010109,unknown,Ranebennur tense; bandh successful
582,20010109,unknown,Britisher found dead
583,20010109,unknown,Take citizens into your confidence; CM tells police
584,20010109,unknown,State to crack down on illegal plastic production
585,20010109,unknown,Krishna reviews matters of his constituency
586,20010109,unknown,Now JD(S) gives clearance for merger with JD(U)
587,20010109,unknown,Shoulder injury sends Kumble into a spin
588,20010109,unknown,Treasury dept to be computerised in year
589,20010109,unknown,Art exhibition to raise funds for music school
590,20010109,unknown,Cotton row: Govt open to talks
591,20010109,unknown,TADA judge issues notices to 10 witnesses
592,20010109,unknown,Grid problems hits power supply
593,20010109,unknown,Probe ordered into chick colouring
594,20010109,unknown,Has it; doesn't flaunt it
595,20010109,unknown,Falun Gong is free because we can't sell spiritualism
596,20010109,unknown,'Erosion in value system in civil society'
597,20010109,unknown,Contempt notice for disobeying HC order
598,20010109,unknown,'Medical evidences should corroborate charges levelled by victim'
599,20010109,unknown,BCC submits memo in HC
600,20010109,unknown,The best things in life
601,20010109,unknown,'Superstition; poverty increasing AIDS cases'
602,20010109,unknown,Financier Bharat Shah held for alleged links with Chotta Shakeel
603,20010109,unknown,Officials brace for millennium's first Mahakumbh
604,20010109,unknown,Material souls to seek salvation by the Ganga
605,20010109,unknown,Vajpayee woos Vietnam with infotech
606,20010109,unknown,All party meet on joint cadre issue soon: CM
607,20010109,unknown,One more advocate general for Goa soon
608,20010109,unknown,Order on plastic ban soon
609,20010109,unknown,Campaign to educate vendors selling cigarette; gutka
610,20010109,unknown,Hike in water tariff from March
611,20010109,unknown,Construction of Swatantra Veer Chowk mooted
612,20010109,unknown,Lunar eclipse on Jan. 9 and 10
613,20010109,unknown,Hefty phone bill shocks officials
614,20010109,unknown,50 handicaps to get artificial limbs
615,20010109,unknown,ABVP organises reception for students
616,20010109,unknown,Infrastructure development corporation to be constituted
617,20010109,unknown,Seminar on industrial gases from Jan. 19
618,20010109,unknown,New molecule to fight malaria found
619,20010109,unknown,Brain's sensory filter smaller in schizophrenics
620,20010109,unknown,Mice to blame for childhood asthma?
621,20010109,unknown,Controlled drinking may be answer for alcoholics
622,20010109,unknown,'No radiation sickness among Bulgarian troops'
623,20010109,unknown,STF is working without sleep; food: Sangliana
624,20010109,unknown,Danger lurks at most city pubs
625,20010109,unknown,Centre's ditherings dangerous: Chandra Shekhar
626,20010109,unknown,New tariffs bad news for cellphone operators
627,20010109,unknown,Jaya Jaitly unanimously elected Samata chief
628,20010109,unknown,Bus station at Shivajinagar set to open
629,20010109,unknown,CM gets a 'majority darshan'
630,20010109,unknown,CET Cell returns Rs 13 cr to govt
631,20010109,unknown,Ranebennur tense; bandh successful
632,20010109,unknown,Britisher found dead
633,20010109,unknown,Take citizens into your confidence; CM tells police
634,20010109,unknown,State to crack down on illegal plastic production
635,20010109,unknown,Krishna reviews matters of his constituency
636,20010109,unknown,Now JD(S) gives clearance for merger with JD(U)
637,20010109,unknown,Shoulder injury sends Kumble into a spin
638,20010109,unknown,Treasury dept to be computerised in year
639,20010109,unknown,Art exhibition to raise funds for music school
640,20010109,unknown,Cotton row: Govt open to talks
641,20010109,unknown,TADA judge issues notices to 10 witnesses
642,20010110,city.patna,Fend for yourselves; Pande tells doctors
643,20010110,city.patna,Bureaucracy undermining legislature's 'existence'
644,20010110,city.patna,State police collapses under pressure
645,20010110,city.patna,Court declares Pappu Yadav an absconder
646,20010111,sports.cricket.news,shreyas gopal scores ton as karnataka stay on top of mumbai
647,20010111,sports.football,japan edge north korea in politically charged opener
648,20010123,unknown,Sonia takes on the Hindutva brigade
649,20010123,unknown,Congress hopes soar; BJP cries foul
650,20010123,unknown,Ceasefire decision likely today
651,20010123,unknown,Ceasefire blues: To end or extend truce
652,20010123,unknown,So Young; So Successful
653,20010123,unknown,Kumbh Karma
654,20010123,unknown,Greenmail & White Knights
655,20010123,unknown,Child of Fortune
656,20010123,unknown,One-way Street
657,20010123,unknown,Towards a Theory of Everything - II
658,20010123,unknown,Seeing is Believing
659,20010123,unknown,Wockhardt plans another cardiac centre
660,20010123,unknown,Inside Track
661,20010123,unknown,CM for action against officials depositing funds in non-scheduled banks
662,20010123,unknown,Blood donation no more safe in hospitals
663,20010123,unknown,BJP asks govt to learn lessons from 'failed MoUs'
664,20010123,unknown,Surveillance along coastal belt stepped up
665,20010123,unknown,Cong opposes Vaze as GPSC chief
666,20010123,unknown,Minister to verify info on Goans in star hotels
667,20010123,unknown,Tillari: Rehabilitation first; says Oppn
668,20010123,unknown,Rape accused acquitted
669,20010123,unknown,Milk price hike: Govt to do a rethink
670,20010123,unknown,Career information fair from Feb 17
671,20010123,unknown,Assembly congratulates Anil Kakodkar
672,20010123,unknown,Multi-religious meet held
673,20010123,unknown,Kirti is Reddy for 'Pyaar Ishq Aur Mohabbat'!
674,20010123,unknown,Nasir Khan: Small to big!
675,20010123,unknown,Pooja Batra: Curry on Pooja!
676,20010123,unknown,Shamita Shetty: 'Mohabbat' all the way
677,20010123,unknown,Pankaj Udhas: Technological voices!
678,20010123,unknown,Kirti is Reddy for 'Pyaar Ishq Aur Mohabbat'!
679,20010123,unknown,Pankaj Udhas: Technological voices!
680,20010123,unknown,Pooja Batra: Curry on Pooja!
681,20010123,unknown,Shamita Shetty: 'Mohabbat' all the way
682,20010123,unknown,Nasir Khan: Small to big!
683,20010123,unknown,Bajaj Auto to sell 26% in tempo arm; withdraw name
684,20010123,unknown,Timex to create new image with 180 models
685,20010123,unknown,Kawasaki to re-negotiate stake purchase
686,20010123,unknown,NIIT net seen up 50 per cent at Rs 27 crore
687,20010123,unknown,Now; imported products need to meet Indian standard
688,20010123,unknown,Branded jewellery set to dazzle some more
689,20010123,unknown,Net familiarity will drive e-commerce
690,20010123,unknown,Net familiarity will drive e-commerce
691,20010123,unknown,Digitalising consultancy at Orbit-e
692,20010123,unknown,Way2Wealth positions as one-stop financial shop
693,20010123,unknown,Govt to table 13 bills in ongoing assembly session
694,20010123,unknown,Cong leaders asked to decide on tie with Trinamul
695,20010123,unknown,CPM interference in agriculture varsity
696,20010123,unknown,Nation-wide red alert regarding toxic tea
697,20010123,unknown,Viren Shah 'out-walks' the Opposition
698,20010123,unknown,Highlights of Viren J. Shah's speech
699,20010123,unknown,Sramik Union supports Baranagar mill violence
700,20010123,unknown,CMC seeks police help to protect statues
701,20010123,unknown,Increase in Haj pilgrims from state
702,20010123,unknown,'Withholding teachers' salaries was collective decision'
703,20010123,unknown,Ceasefire camouflages factional strife in Nagaland
704,20010123,unknown,NHRC issues notice to WB home secy
705,20010123,unknown,Protest against port in Kulpi
706,20010123,unknown,Mamata to attend police body meet today
707,20010123,unknown,'Empowered' women of Kochpukur impress Lara
708,20010123,unknown,Medical college for Sikkim by July
709,20010124,unknown,Govt extends J&K ceasefire by a month
710,20010124,unknown,Peace hinges on human rights
711,20010124,unknown,Two crore at Mahakumbh for the big bath
712,20010124,unknown,Minister inquired about Hinduja passport; admits UK
713,20010124,unknown,First R&D; then food for all
714,20010124,unknown,Globo God
715,20010124,unknown,Pilgrim's Process
716,20010124,unknown,Sustainable Ceasefire
717,20010124,unknown,Beauty and the Beast
718,20010124,unknown,Urban Apartheid
719,20010124,unknown,Spiritual Quotient Leverages IQ & EQ
720,20010124,unknown,The Veggie Abroad
721,20010124,unknown,Purifying Ourselves
722,20010124,unknown,Labour of Law
723,20010124,unknown,Boby's fight for love
724,20010124,unknown,Dharmendra: Suicide Suicide!
725,20010124,unknown,Sunny Deol: Lessons Learned!
726,20010124,unknown,British Indian to present Kama Sutra series
727,20010124,unknown,Farouq Rattonsey: Third Time Lucky?
728,20010124,unknown,Welfare fund for film artistes
729,20010124,unknown,'Our department is life'
730,20010124,unknown,Bitter reality bared
731,20010124,unknown,Keep danbruff at an arms distance
732,20010124,unknown,Awareness is essential
733,20010124,unknown,A Fashion excuse
734,20010124,unknown,Plane mishap averted at Patna
735,20010124,unknown,Two CPI(ML) activists die in Gaya police firing
736,20010124,unknown,Gold gifts to Misa may trouble their presenters
737,20010124,unknown,Police hesitant in lodging case against Sadhu; Modi
738,20010124,unknown,CPI decides to continue agitation
739,20010124,unknown,Jharkhand govt to set up own power grid
740,20010124,unknown,Minister warns banks of economic non-cooperation
741,20010124,unknown,Dalit outfits to hold rally before HC
742,20010124,unknown,Court asks DG to travel on highways in Bihar
743,20010124,unknown,3 cellphones recovered from Muzaffarpur jail
744,20010124,unknown,Trader was freed on payment of Rs 2.5 crore
745,20010124,unknown,Samata's Kurmi card on test in Asthawa
746,20010124,unknown,Govt to seek fresh cadre option from staff
747,20010124,unknown,LNMU V-C cancels teachers' deputation to town colleges
748,20010124,unknown,Shamiana replaces exam halls
749,20010124,unknown,Cellphone services at loggerheads in Patna
750,20010124,unknown,Concentrate on developmental activities: Naidu
751,20010124,unknown,TDP will not rock NDA boat: Naidu
752,20010124,unknown,Noose tightens for those causing noise pollution
753,20010124,unknown,Centre to give big push to herbal sector
754,20010125,unknown,Kabhi Cushy; Kabhi Grim
755,20010125,unknown,Big bath passes without a hitch
756,20010125,unknown,Security bandobast: The one that got away
757,20010125,unknown,Enron allowed to enhance stake in Dhabol project
758,20010125,unknown,Govt has discretionary powers to deny passports
759,20010125,unknown,A view from far and near
760,20010125,unknown,'Temptation Island' beats 'The Mole'
761,20010125,unknown,Kasparov drubs Shirov; takes joint lead
762,20010125,unknown,Dino Morrea: Bhatt; seriously!
763,20010125,unknown,Kabhi Insured Kabhi Nahi!
764,20010125,unknown,'Samosa Queen' among richest UK businesswomen
765,20010125,unknown,Ustad Zakir Hussain: Drumming high
766,20010125,unknown,Priyadarshan: Angrezi Babu?
767,20010125,unknown,Dino Morrea: Bhatt; seriously!
768,20010125,unknown,Ministers under threat
769,20010125,unknown,A wait in vain for our young neighbours?
770,20010125,unknown,No tableaux yet from brand-new states
771,20010125,unknown,Birds pecking at meatshop waste may disrupt flypast
772,20010125,unknown,DDA take responsibility for power; water in its properties: Court
773,20010125,unknown,How much longer; SC asks govt
774,20010125,unknown,The court has faith in us: Jagmohan
775,20010125,unknown,MCD begins the clean-up act
776,20010125,unknown,Illegal arms flood Delhi
777,20010125,unknown,Killer roads claim more; 7 dead in 24 hrs
778,20010125,unknown,Link between Noida-South Delhi slashes distances
779,20010125,unknown,Tax doubles Noida schoolbus fee; parents upset
780,20010125,unknown,Dancing is a pleasure; but give us hot food and water; say artistes
